{
  "schema_version": "1.0",
  "record_version": 1,
  "record_id": "1efaacd2-389e-483b-a303-5c27bcb006bc",
  "source_id": "meeting-hotel-kickoff-2026-09-15",
  "source_title": "HotelOS Project Kickoff",
  "source_type": "transcript",
  "meeting_date": "2026-09-15",
  "participants": [
    "Ranidu",
    "Esandu",
    "Haritha"
  ],
  "consent_flag": true,
  "generated_at": "2026-08-21T12:03:54.681828+00:00",
  "generated_by": "meeting-intelligence-agent",
  "actions": [],
  "decisions": [],
  "risks": [],
  "signals": [],
  "pending_not_included": 0,
  "rejected_not_included": 0,
  "expired_not_included": 0
}