{
  "schema_version": "1.0",
  "record_version": 1,
  "record_id": "4752d434-912a-41cc-b568-24277e93d267",
  "source_id": "chat-export-meridian-2024-11-20",
  "source_title": "Meridian Project Channels Export",
  "source_type": "chat_export",
  "meeting_date": "2024-11-20",
  "participants": [
    "Sarah Chen",
    "Priya Sharma",
    "Priya Menon",
    "James Liu",
    "Marcus Webb",
    "Lisa Tran",
    "David Park"
  ],
  "consent_flag": true,
  "generated_at": "2026-08-21T12:04:32.849855+00:00",
  "generated_by": "meeting-intelligence-agent",
  "actions": [],
  "decisions": [],
  "risks": [],
  "signals": [
    {
      "id": "chat-export-meridian-2024-11-20::signal::828fc30e",
      "type": "signal",
      "payload": {
        "classification": "blocker",
        "text": "Heads up: the staging environment is down. The SSL certificate expired overnight. Can't run any integration tests until it's fixed.",
        "reason": "Integration testing is stopped because the staging environment is down.",
        "channel": "proj-meridian-dev",
        "author": "Marcus Webb",
        "message_id": "msg_003"
      },
      "citation": {
        "source_id": "chat-export-meridian-2024-11-20",
        "source_title": "Meridian Project Channels Export",
        "speaker": "Marcus Webb",
        "timestamp": "2024-11-18T09:22:00Z",
        "quote": "Can't run any integration tests until it's fixed.",
        "quote_verified": true,
        "char_start": null,
        "char_end": null
      },
      "confidence": 1.0,
      "approved_by": "esandu",
      "approved_at": "2026-08-21T12:04:32.839414+00:00",
      "edited_by_reviewer": false
    },
    {
      "id": "chat-export-meridian-2024-11-20::signal::13c8cec1",
      "type": "signal",
      "payload": {
        "classification": "request",
        "text": "Can someone from the design team sync the tokens? I don't want to do it manually and risk getting it wrong.",
        "reason": "Asking the design team to sync the tokens.",
        "channel": "proj-meridian-dev",
        "author": "Priya Menon",
        "message_id": "msg_008"
      },
      "citation": {
        "source_id": "chat-export-meridian-2024-11-20",
        "source_title": "Meridian Project Channels Export",
        "speaker": "Priya Menon",
        "timestamp": "2024-11-18T09:50:00Z",
        "quote": "Can someone from the design team sync the tokens?",
        "quote_verified": true,
        "char_start": null,
        "char_end": null
      },
      "confidence": 1.0,
      "approved_by": "esandu",
      "approved_at": "2026-08-21T12:04:32.840909+00:00",
      "edited_by_reviewer": false
    },
    {
      "id": "chat-export-meridian-2024-11-20::signal::bbb5bf21",
      "type": "signal",
      "payload": {
        "classification": "decision",
        "text": "After standup discussion: we've decided to move the client demo from Thursday to next Monday. David's CTO has a conflict on Thursday.",
        "reason": "Rescheduling the client demo to next Monday.",
        "channel": "proj-meridian-dev",
        "author": "Sarah Chen",
        "message_id": "msg_009"
      },
      "citation": {
        "source_id": "chat-export-meridian-2024-11-20",
        "source_title": "Meridian Project Channels Export",
        "speaker": "Sarah Chen",
        "timestamp": "2024-11-18T10:30:00Z",
        "quote": "we've decided to move the client demo from Thursday to next Monday.",
        "quote_verified": true,
        "char_start": null,
        "char_end": null
      },
      "confidence": 1.0,
      "approved_by": "esandu",
      "approved_at": "2026-08-21T12:04:32.842247+00:00",
      "edited_by_reviewer": false
    },
    {
      "id": "chat-export-meridian-2024-11-20::signal::ab39f49f",
      "type": "signal",
      "payload": {
        "classification": "request",
        "text": "Just got off a call with Lisa. The client wants a written summary of all the architectural decisions we've made so far. Can someone compile a list from our ADR folder and send it to me by end of week?",
        "reason": "Asking someone to compile a list of architectural decisions.",
        "channel": "proj-meridian-dev",
        "author": "Sarah Chen",
        "message_id": "msg_015"
      },
      "citation": {
        "source_id": "chat-export-meridian-2024-11-20",
        "source_title": "Meridian Project Channels Export",
        "speaker": "Sarah Chen",
        "timestamp": "2024-11-18T13:00:00Z",
        "quote": "Can someone compile a list from our ADR folder and send it to me by end of week?",
        "quote_verified": true,
        "char_start": null,
        "char_end": null
      },
      "confidence": 1.0,
      "approved_by": "esandu",
      "approved_at": "2026-08-21T12:04:32.843523+00:00",
      "edited_by_reviewer": false
    },
    {
      "id": "chat-export-meridian-2024-11-20::signal::fa1b72a9",
      "type": "signal",
      "payload": {
        "classification": "blocker",
        "text": "Blocker: the Meridian Pay sandbox API is returning 503 errors again. This is the third time this week. We cannot test the payment flow at all right now.",
        "reason": "Payment flow testing is blocked by sandbox API errors.",
        "channel": "proj-meridian-dev",
        "author": "Sarah Chen",
        "message_id": "msg_019"
      },
      "citation": {
        "source_id": "chat-export-meridian-2024-11-20",
        "source_title": "Meridian Project Channels Export",
        "speaker": "Sarah Chen",
        "timestamp": "2024-11-18T15:00:00Z",
        "quote": "We cannot test the payment flow at all right now.",
        "quote_verified": true,
        "char_start": null,
        "char_end": null
      },
      "confidence": 1.0,
      "approved_by": "esandu",
      "approved_at": "2026-08-21T12:04:32.845459+00:00",
      "edited_by_reviewer": false
    }
  ],
  "pending_not_included": 15,
  "rejected_not_included": 1,
  "expired_not_included": 0
}